URL,Title,Description
https://www.indeed.com/m/viewjob?jk=ebd561cb5f4f9a69&from=serp&tk=1ivoq2u81gooo88q&advn=4680988703952048&adid=442914514&ad=-6NYlbfkN0B1bNt2Sa2Dgn_D2cnA-iRTzMpUZa-w9gILfylxQmhZbHA3dPTle3DTg7JUmdSY6rZ3cFp6gYPbYQelAUjQZxkFVAzOI9OPRbTygcoWwhDg-D1NLT-saIV2l8aoXuYnmsPhgWvrps85UgAsrslUjO_RmHWxhZXqudXqHgj9NN5HVBYu_FQJfVO0EQl_zMK05xA8iPV8o13nw5vUBHpgg3kWE4IJWzWH9EMgFcvrbUUl1VKa2-yxaAg2OQBzNWh1ofzmv2qqsmHic71dvKR1EPdTXW5yUgv11asnkpp15qLGs2VKT6e8K5pzCLQwOf1fzBExS5RwGa0nUhn9vfjTeEtok8oDrsoeq9brm3alQAlujdBOVuH4Z3K2Tl-9yGVYHxGPG2jfHG7rftp_MAZTx6E4JV-MQpT3RHgeX3C-De5DY6WWZ2W5NBrNWraxxxycxbvXvskm9TgS9-OdSdtLgjKTmXcp2recReUNjLVO-bkYZsZr8ie74x4iL2fbYuQ0-DS6IWX0G1M0NA_8Kty59ihwwQdaix3iLxxk1w-vbngWn6lwrGjQVZZj9cgsiwJ3ZMR_dhsbAcflEPkSiZMUBv5gOhkhGDKx4xEHXbBNLo2LH0ZrfNFihhnQRXYCL0I1JYT_ms0NmkA_AAwyVYCxiyjUa117-bHIDdeMvfjntHTCk7JXDJn3We5ogqNb1YkfXfWvHcPVSLvYvpek3s1xH8HYQ5ffHwcemxecEoqzR8ueYw%3D%3D&xkcb=SoD06_M3w48EFhTS0Z0TbzkdCdPP,Error - Could not fetch,403 Client Error: Forbidden for url: https://www.indeed.com/m/viewjob?jk=ebd561cb5f4f9a69&from=serp&tk=1ivoq2u81gooo88q&advn=4680988703952048&adid=442914514&ad=-6NYlbfkN0B1bNt2Sa2Dgn_D2cnA-iRTzMpUZa-w9gILfylxQmhZbHA3dPTle3DTg7JUmdSY6rZ3cFp6gYPbYQelAUjQZxkFVAzOI9OPRbTygcoWwhDg-D1NLT-saIV2l8aoXuYnmsPhgWvrps85UgAsrslUjO_RmHWxhZXqudXqHgj9NN5HVBYu_FQJfVO0EQl_zMK05xA8iPV8o13nw5vUBHpgg3kWE4IJWzWH9EMgFcvrbUUl1VKa2-yxaAg2OQBzNWh1ofzmv2qqsmHic71dvKR1EPdTXW5yUgv11asnkpp15qLGs2VKT6e8K5pzCLQwOf1fzBExS5RwGa0nUhn9vfjTeEtok8oDrsoeq9brm3alQAlujdBOVuH4Z3K2Tl-9yGVYHxGPG2jfHG7rftp_MAZTx6E4JV-MQpT3RHgeX3C-De5DY6WWZ2W5NBrNWraxxxycxbvXvskm9TgS9-OdSdtLgjKTmXcp2recReUNjLVO-bkYZsZr8ie74x4iL2fbYuQ0-DS6IWX0G1M0NA_8Kty59ihwwQdaix3iLxxk1w-vbngWn6lwrGjQVZZj9cgsiwJ3ZMR_dhsbAcflEPkSiZMUBv5gOhkhGDKx4xEHXbBNLo2LH0ZrfNFihhnQRXYCL0I1JYT_ms0NmkA_AAwyVYCxiyjUa117-bHIDdeMvfjntHTCk7JXDJn3We5ogqNb1YkfXfWvHcPVSLvYvpek3s1xH8HYQ5ffHwcemxecEoqzR8ueYw%3D%3D&xkcb=SoD06_M3w48EFhTS0Z0TbzkdCdPP
https://www.tomsguide.com/ai/the-first-truly-copyright-free-ai-video-generator-has-arrived-heres-what-we-know,The first truly copyright-free AI video generator has arrived — here's what we know | Tom's Guide,This new model from the brand Moonvalley is bringing copyright-free AI video to the world.
https://mashable.com/article/best-prime-day-robot-vacuum-deals-2025-july-10,"Best Prime Day robot vacuum deals: Shop Roombas, Roborocks | Mashable",Prime Day robot vacuum deals are out in full force at Amazon. Save hundreds on the newest Roombas and the Roborock Saros 10R.
https://www.whistleout.com/CellPhones/Guides/best-new-apps,Error - Could not fetch,403 Client Error: Forbidden for url: https://www.whistleout.com/CellPhones/Guides/best-new-apps
https://www.zdnet.com/article/best-prime-day-samsung-deals-2025-07-10/,Best Prime Day Samsung deals: My 30+ favorite sales live right now | ZDNET,"We are in the third phase of Prime Day, and I've found excellent deals and discounts on Samsung TVs, tablets, watches, monitors, and more -- including Samsung's new Galaxy smartphone range."
https://m.economictimes.com/markets/stocks/news/shaan-patel-asset-management-launches-first-alternative-investment-fund-with-a-flexi-cap-approach/articleshow/122361954.cms?UTM_Source=Google_Newsstand&UTM_Campaign=RSS_Feed&UTM_Medium=Referral,Shaan Patel Asset Management launches first Alternative Investment Fund with a flexi-cap approach - The Economic Times,"In a strategic move aimed at redefining active equity investing for sophisticated investors, Shaan Patel Asset Management has officially launched its first Alternative Investment Fund (AIF) under the Category III segment."
https://cybernews.com/tech/openai-io-startup-deal-finalized/,Error - Could not fetch,403 Client Error: Forbidden for url: https://cybernews.com/tech/openai-io-startup-deal-finalized/
https://www.cnet.com/tech/gaming/todays-nyt-connections-sports-edition-hints-and-answers-for-july-10-290/,"Today's NYT Connections: Sports Edition Hints, Answers for July 10 #290 - CNET","Here's today's Connections: Sports Edition answer and hints for groups. These clues will help you solve The New York Times' popular puzzle game, Connections: Sports Edition, every day."
https://www.telegraph.co.uk/money/pensions/retired-early-db-pension/,‘I retired early with a £450k pension – can I avoid paying higher-rate tax?’,Rate My Portfolio: our reader wants to leave his Sipp capital intact while drawing income
