URL,Title,Description
https://www.commonsensemedia.org/lists/50-apps-all-kids-should-play-at-least-once,50 Apps All Kids Should Play at Least Once | Common Sense Media,"Common Sense Media editors help you choose 50 Apps All Kids Should Play at Least Once. Like highly acclaimed movies and books, these apps are just too good to miss."
https://www.g2.com/products/empromptu/competitors/alternatives,Error - Could not fetch,403 Client Error: Forbidden for url: https://www.g2.com/products/empromptu/competitors/alternatives
https://www.99signals.com/appsumo-deals/,50 Best AppSumo Lifetime Deals in July 2025,Never pay full price for business software. Here are all the top deals AppSumo is offering on business tools and software in July 2025.
https://apps.apple.com/us/app/mighty-cleaner-ai-clean-up/id6448141961,‎Mighty Cleaner: AI Clean Up on the App Store,"Discover Mighty Cleaner: Your Smart Solution for Freeing Up Phone Space!

Tired of running out of space on your phone? Struggling with these common issues?
· Mi…"
https://www.nytimes.com/wirecutter/money/,Money Management and Personal Finance Advice | Wirecutter,"We've spent hundreds of hours determining the best apps, tools, credit cards, insurance, and more for you to get the most out of your money."
https://www.consumerreports.org/,"Product Reviews and Ratings, Buying Advice and Consumer Advocacy - Consumer Reports","Get unbiased ratings and reviews for 10,000+ products and services from Consumer Reports, plus trusted advice and in-depth reporting on what matters most."
https://www.consumerreports.org/cro/a-to-z-index/products/index.htm,A-Z from ConsumerReports.org,Complete listing of ConsumerReports.org products from A to Z.
https://www.consumerreports.org/appliances/refrigerators/best-refrigerators-of-the-year-a6399727407/,Best Refrigerators: 11 Top Models for July 2025 - Consumer Reports,"These are the best refrigerators you can buy right now, according to CR’s exclusive tests, from Dacor, Danby, GE, LG, Samsung, and Sub-Zero."
https://www.consumerreports.org/cars/suvs/best-deals-on-new-suvs-a3535956359/,Best Deals on SUVs You Can Buy Right Now - Consumer Reports,"Consumer Reports highlights the best deals on new 2025 SUVs, featuring good, safe, reliable SUVs with savings up to 19 percent off the MSRP."
https://www.consumerreports.org/cars/buying-a-car/best-new-car-deals-for-memorial-day-a8654176197/,Best New Car Deals for Memorial Day Weekend and Beyond - Consumer Reports,"CR details best new car deals for Memorial Day 2025. Over the holiday weekend and through May, you'll find big savings on these good cars and SUVs."
https://wise.com/gb/blog/small-business-expense-tracking,7 Best Small Business Expense Tracking Apps (UK -  2024) - Wise,"Read our essential guide to the best UK small business expense tracking apps, including Zoho, Expensify, Xero and more."
https://apps.shopify.com/zendrop/reviews,Reviews: Zendrop ‑ Dropshipping & POD - Zendrop: #1 Shopify dropshipping app. Start free. | Shopify App Store,"Build a successfull dropshipping business. Get access to 1M+ products, auto-fulfillment, super-fast shipping, custom branding, and world-class support"
https://screenapp.io/nl/blog/category/alternatives-and-com/3,Alternatives And Com - Page 3 - Blog Articles,Explore our alternatives and com articles. Page 3 of 4 - 40 expert insights and tutorials in alternatives and com.
https://www.spocket.co/blogs/deepseek-alternatives?srsltid=AfmBOoqtnL9EfDt4kisCu6jU0lsk5HA4TilWf9FM-mjXEtbblIApCUlZ,"Top Deepseek Alternatives for Chat, Coding & Research","Explore the best Deepseek alternatives for writing, coding, and AI chat. Compare features, pricing, and real-world use cases to find your perfect AI match."
https://www.trustpilot.com/review/ratepunk.com,Ratepunk Reviews | Read Customer Service Reviews of ratepunk.com,"Do you agree with Ratepunk's 4-star rating? Check out what 867 people have written so far, and share your own experience."
https://www.nytimes.com/wirecutter/,"Wirecutter: New Product Reviews, Deals, and Buying Advice","Wirecutter tests and reviews the best tech, appliances, gear, and more. You can trust our veteran journalists, scientists, and experts to find the best stuff."
https://www.saasworthy.com/blog/best-photo-organizer-apps-with-facial-recognition,Error - Could not fetch,403 Client Error: Forbidden for url: https://www.saasworthy.com/blog/best-photo-organizer-apps-with-facial-recognition
https://apps.apple.com/us/app/lens-for-watch/id1453244843,‎Lens for Watch on the App Store,"Lens – Instagram for Apple Watch

Scroll your feed, double-tap to like, drop a comment, swipe through Stories, and even reply to DMs — all from your wrist. 

As…"
https://www.commonsensemedia.org/lists/apps-for-kids-who-think-reading-is-boring,Apps for Kids Who Think Reading Is Boring | Common Sense Media,"Common Sense Media editors help you choose Apps for Kids Who Think Reading Is Boring. For some kids, picking up a book is like torture. Take the sting out of text and find a fun inroad with these apps."
https://www.sprypt.com/blog/insync-ehr-alternatives,Top InSync EHR Alternatives for Behavioral Health in 2025,"Jul 09, 2025-Explore 10 best InSync EHR alternatives built for therapy and behavioral health. Compare AI, mobile access, and specialty workflows to boost your practice."
https://au.trustpilot.com/review/theliven.com,Liven Reviews | Read Customer Service Reviews of theliven.com,"9,692 people have already reviewed Liven. Read about their experiences and share your own!"
https://www.websitebuilderexpert.com/website-builders/wix-pricing/,Wix Pricing Plans 2025: All Costs & Fees Explained,"Choosing between Wix's pricing plans? I'll show you which plan is the best value for money, delving into the different price points and key features included."
https://www.gartner.com/reviews/market/email-security-platforms/vendor/microsoft/product/microsoft-exchange-online-protection/alternatives,Error - Could not fetch,403 Client Error: Forbidden for url: https://www.gartner.com/reviews/market/email-security-platforms/vendor/microsoft/product/microsoft-exchange-online-protection/alternatives
https://www.b2breviews.com/reviews/zoho-vault/,Error - Could not fetch,403 Client Error: Forbidden for url: https://www.b2breviews.com/reviews/zoho-vault/
https://www.margaritavilleatsea.com/current-offers/thank-you-for-your-service-month,#1 Best Cruise Line for Heroes | Margaritaville at Sea,"From the best-ever cruise fares to free cabin drops and special onboard programming, there's no shortage of ways we celebrate Heroes."
https://findstack.com/products/adobe-dreamweaver/reviews,"Adobe Dreamweaver Reviews 2025: Pricing, Features, & Alternatives","Adobe Dreamweaver is part of the Adobe Creative Cloud which also includes Photoshop and Indesign. The platform lets you create and design websites, with a co..."
https://www.amazon.com/Housemaid-Freida-McFadden/dp/1538742578,Amazon.com,No Description Found
https://finance.yahoo.com/personal-finance/credit-cards/article/is-the-new-chase-sapphire-reserve-worth-it-163010812.html,Is the new Chase Sapphire Reserve worth it — and what are some alternatives?,"The Chase Sapphire Reserve has updated benefits and now carries a huge $795 annual fee. Is it still worth it, or should you consider alternative travel credit cards?"
https://www.pcmag.com/,"The Latest Technology Product Reviews, News, Tips, and Deals | PCMag","PCMag is your complete guide to computers, peripherals and upgrades. We test and review tech products and services, report technology news and trends, and provide shopping advice with price comparisons."
https://www.aol.com/finance/4-best-gas-apps-2025-190500384.html,The 4 best gas apps of 2025,Using one of the best gas apps can save you money.
https://www.makingthatwebsite.com/free-website-builder-with-custom-domain/,10 Free Website Builders that let you add custom Domain,Free website builders that let you create a website with your own custom domain for free. Create a free website if you already have a domain.
https://screenapp.io/blog/category/video-tools,Video Tools - Blog Articles,Explore our video tools articles. 8 expert insights and tutorials in video tools.
https://www.producthunt.com/,Product Hunt – The best new products in tech.,"Product Hunt is a curation of the best new products, every day. Discover the latest mobile apps, websites, and technology products that everyone's talking about."
https://www.softwareadvice.com/productivity/microsoft-excel-profile/,Error - Could not fetch,403 Client Error: Forbidden for url: https://www.softwareadvice.com/productivity/microsoft-excel-profile/
https://wallethub.com/d/university-of-texas-exes-credit-card-1815c,University of Texas Exes Credit Card Reviews: Is It Worth It? (2025),"Reviews, rates, fees, and rewards details for The University of Texas Exes Credit Card. Compare to other cards and apply online in seconds"
https://www.35mmc.com/category/reviews-experinces/,Gear Reviews & Experiences Archives - 35mmc,No Description Found
https://money.usnews.com/credit-cards/travel,Error - Could not fetch,"HTTPSConnectionPool(host='money.usnews.com', port=443): Read timed out. (read timeout=10)"
https://www.hollywoodreporter.com/news/general-news/best-amazon-prime-day-2025-alternatives-deals-sales-1236303488/,"The Best Amazon Prime Day Alternative Sales 2025: Target, Wayfair","We've rounded up the best competing Amazon Prime Day 2025 sales at Target, Nordstrom, Wayfair, Saks Fifth Avenue, Brookinen and more."
https://www.nerdwallet.com/article/taxes/itemized-deductions-standard-deduction,"Itemized Deductions: How They Work, Common Types - NerdWallet","Itemized deductions are tax deductions for specific expenses. When they add up to more than the standard deduction, itemized deductions can save more on taxes."
https://www.marriott.com/en-us/hotels/sangl-san-diego-marriott-gaslamp-quarter/overview/,Error - Could not fetch,403 Client Error: Forbidden for url: https://www.marriott.com/en-us/hotels/sangl-san-diego-marriott-gaslamp-quarter/overview/
https://www.mobileaction.co/,MobileAction - Growth partner of apps and games,"Maximize your app's potential with intelligence, automation and expertise. Rank higher, attract more users and get installs for your games and apps."
https://www.capterra.com.au/alternatives/1077320/Teep,Error - Could not fetch,403 Client Error: Forbidden for url: https://www.capterra.com.au/alternatives/1077320/Teep
https://zapier.com/blog/dropbox-vs-google-drive/,Dropbox vs. Google Drive: Which is best? [2025] | Zapier,Trying to decide between Dropbox and Google Drive? This Google Drive vs. Dropbox showdown will help you pick the right tool for you.
https://news.macgasm.net/reviews/disk-drill-mac-review/,Disk Drill 6 for Mac In-Depth Review | 2025 Guide,"In this review, we're taking a detailed look at the latest version of Disk Drill for Mac, one of the most popular recovery tools available to Mac users."
https://www.tripadvisor.com/Restaurant_Review-g187791-d2358486-Reviews-Mama_Eat_Roma_Trastevere-Rome_Lazio.html,Error - Could not fetch,403 Client Error: Forbidden for url: https://www.tripadvisor.com/Restaurant_Review-g187791-d2358486-Reviews-Mama_Eat_Roma_Trastevere-Rome_Lazio.html
https://wordpress.org/plugins/simple-tags/,"WordPress Tag, Category, and Taxonomy Manager – AI Autotagger – WordPress plugin | WordPress.org","Tags, Categories and WordPress terms are easy with TaxoPress. Add a Tag or Category to Pages, manage your WooCommerce Categories and Tags and more."
https://www.safehome.org/security-systems/best/,The Best Home Security Systems of 2025,"Vivint, ADT, and SimpliSafe top our list of the best home security systems based on features, cost, and reliability"
https://gizmodo.com/download/google-playstore,"Download Google Play Store (free) for Android, APK and Web App | Gizmodo","The Google Play Store is the official marketplace for all Android devices. From there, you can search content and download your favorite apps for your smartphone or tablet with a click of a button. Note that some apps are not free."
https://cybernews.com/best-password-managers/is-icloud-keychain-safe/,Error - Could not fetch,403 Client Error: Forbidden for url: https://cybernews.com/best-password-managers/is-icloud-keychain-safe/
https://www.zdnet.com/article/best-data-removal-services/,Best data removal services 2025: Delete yourself from the internet | ZDNET,"Erase yourself from the internet with my favorite data removal services. If you want to pry your personal information out of the hands of data brokers, check out these solutions."
https://www.telegraph.co.uk/recommended/home/best-fans/,"The 15 best fans, tried and tested to keep you cool through the heatwave at home or in the office","A good fan will keep you cool all summer long. Here are the best models for a breeze based on efficiency, design and value for money"
https://www.northerner.com/,Northerner Homepage | Nicotine Pouches & Tobacco-Free Nicotine Online,Buy nicotine pouches and other nicotine products online at Northerner and receive fast shipping across the U.S. ✔ Low Prices ✔ US Shipping ✔ Wide Assortment
https://www.amazon.com/Make-Your-Bed-Little-Things/dp/1455570249,Amazon.com,No Description Found
https://www.bestproducts.com/tech/gadgets/a28480389/wireless-earbud-earphone-reviews/,The 12 Best Wireless Earbuds of 2025 — Bluetooth Earphone Reviews,I tested today’s top options for hundreds of hours to determine which wireless earbuds are really the best.
https://finance.yahoo.com/,"Yahoo Finance - Stock Market Live, Quotes, Business & Finance News","At Yahoo Finance, you get free stock quotes, up-to-date news, portfolio management resources, international market data, social interaction and mortgage rates that help you manage your financial life."
https://www.peerspot.com/products/bizagi-reviews,Bizagi reviews 2025,"Read in-depth Bizagi reviews from real customers and learn about the pricing, features, and more."
https://etfdb.com/,Error - Could not fetch,403 Client Error: Forbidden for url: https://etfdb.com/
https://www.which.co.uk/,"Which? | Expert testing, reviews and advice - Which?","Which? works for you reviewing products and services, so that you make the best purchase decisions for your needs."
https://www.softwaresuggest.com/apartment-adda,"ADDA Pricing, Features, and Reviews (Jul 2025)","Discover ADDA pricing, features, user reviews, and product details. Request a free demo to see how ADDA can help streamline your business."
https://azure.microsoft.com/en-us/blog/reasoning-reimagined-introducing-phi-4-mini-flash-reasoning/,Reasoning reimagined: Introducing Phi-4-mini-flash-reasoning | Microsoft Azure Blog,"Unlock faster, efficient reasoning with Phi-4-mini-flash-reasoning—optimized for edge, mobile, and real-time applications."
https://careers.zoom.us/jobs/software-development-engineer-san-jose-california-united-states-4d86cbd3-f797-4f56-a99d-d860be14d2c4,"Software Development Engineer - San Jose, California, United States","Software Development EngineerWhat you can expectYou can expect to design and develop high-impact, scalable solutions for Zoom Phone product
About the Team

The engineering team works on the development and evolution of Zoom’s cloud-based phone services. Working with the PM team to execute product strategies and focusing on delivering scalable, reliable, and user-friendly communication solutions. By collaborating with PM, design, sales, and support teams, we ensure seamless integration within the broader Zoom platform, enhancing the telephony experience for users worldwide.Responsibilities
Collaborating with cross-functional teams to turn roadmap vision into deliverables.
Designing and delivering customer-facing features.
Implementing cloud-based automation and deployment..."
https://www.autods.com/blog/dropshipping-tips-strategies/dropshipping-software/,Dropshipping Software: The Top 20+ Tools In 2025 For Beginners,"Looking for the best product for beginners? Discover 20+ top tools and dropshipping software to launch, automate, and grow your store."
https://www.consumerreports.org/video/view/cars/auto-test-track/2310666368001/best-bluetooth-car-kits-for-older-cars/,Best Bluetooth car kits for older cars,"Bluetooth car kits let you talk hand-free while driving. Consumer Reports checked out GoGroove FlexSmart X2, Belkin CarAudio Connect AUX, Jabra Journey and Motorola Roadster 2."
https://www.nerdwallet.com/article/taxes/what-tax-credits-can-i-qualify-for,Popular Tax Credits for 2025: How They Work - NerdWallet,"A tax credit is a dollar-for-dollar reduction of a tax bill, which can reduce what a taxpayer owes or potentially increase their refund."
https://www.flexjobs.com/,Error - Could not fetch,"HTTPSConnectionPool(host='www.flexjobs.com', port=443): Read timed out. (read timeout=10)"
https://wallethub.com/d/northeastern-university-credit-card-233c,Northeastern University Credit Card Reviews: Is It Worth It? (2025),"Reviews, rates, fees, and rewards details for Northeastern University Credit Card. Compare to other cards and apply online in seconds"
https://www.marriott.com/en-us/hotels/wasjw-jw-marriott-washington-dc/overview/,Error - Could not fetch,403 Client Error: Forbidden for url: https://www.marriott.com/en-us/hotels/wasjw-jw-marriott-washington-dc/overview/
https://www.businessinsider.com/guides/deals/prime-day-tv-deals-2025-7,"27 Best Prime Day TV Deals 2025: Samsung, LG, TCL, Vizio, and More","Prime Day has some of the biggest TV discounts we've ever seen, including record-low prices on LG, Sony, Samsung, and Panasonic models."
https://www.bestbuy.com/site/searchpage.jsp?_dyncharset=UTF-8&browsedCategory=pcmcat1720647543741&id=pcat17071&iht=n&ks=960&list=y&qp=features_facet%3DFeatures~ENERGY%20STAR%20Certified&sc=Global&st=pcmcat1720647543741_categoryid%24abcat0101001&type=page&usc=All%20Categories,Error - Could not fetch,"HTTPSConnectionPool(host='www.bestbuy.com', port=443): Read timed out. (read timeout=10)"
https://www.facebook.com/groups/hiltoncancunmarcaribefans/posts/718362890802658/,Error - Could not fetch,400 Client Error: Bad Request for url: https://www.facebook.com/groups/hiltoncancunmarcaribefans/posts/718362890802658/
https://www.vogue.com/article/oura-vs-ultrahuman-ring-review,Oura Ring vs Ultrahuman Ring—We're Settling the Debate  | Vogue,One Vogue contributor puts the Oura ring vs Ultrahuman one to the test—read her experience and learn more about how they work.
https://www.wigs.com/?srsltid=AfmBOooA_EHnJ7o8sNGhMaS2YxjLDNg0NHemTJtQM_78Xhm-x9cuku4M,"Wigs, Lace Front, Human Hair & Synthetic – Wigs.com","Shop the latest name brand wigs - human hair, lace front and synthetic wigs. Benefit from exclusive videos, customer wig reviews + guidance from The Wig Experts."
https://businesstravelerusa.com/news/virgin-atlantic-starlink/,Error - Could not fetch,403 Client Error: Forbidden for url: https://businesstravelerusa.com/news/virgin-atlantic-starlink/
https://www.tripadvisor.com/Attraction_Review-g187791-d23837180-Reviews-Balloon_Museum-Rome_Lazio.html,Error - Could not fetch,403 Client Error: Forbidden for url: https://www.tripadvisor.com/Attraction_Review-g187791-d23837180-Reviews-Balloon_Museum-Rome_Lazio.html
https://www.theverge.com/tech/697599/amazon-prime-day-sale-best-tech-deals-2025-day-3,Day three Prime Day 2025 deals are just as good as day one | The Verge,"The third day of Amazon Prime Day 2025 has arrived. Here, we’re rounding up the best deals on headphones, laptops, smart home gear, TVs, and other gadgets."
https://www.govtech.com/digital-counties-2025-250-000-to-499-999-population-category,"Digital Counties 2025: 250,000 to 499,999 Population Category",The 52 counties honored in this year's awards from the Center for Digital Government are transforming local government with cutting-edge tech while focusing on resident services.
https://explodingtopics.com/blog/e-commerce-store-ai-search,How to Optimize Your E-commerce Store for AI Search,No Description Found
https://www.caranddriver.com/maserati/mcpura,Error - Could not fetch,403 Client Error: Forbidden for url: https://www.caranddriver.com/maserati/mcpura
https://vacuumwars.com/your-guide-to-the-2025-eufy-robot-vacuum-lineup/,Error - Could not fetch,403 Client Error: Forbidden for url: https://vacuumwars.com/your-guide-to-the-2025-eufy-robot-vacuum-lineup/
https://gizmodo.com/download/k-9-mail,"Download K-9 Mail (free) for Android, APK | Gizmodo","Manage email securely with K-9 Mail, a free, open-source Android app that puts privacy first, offering control, efficiency, and reliability without unnecessary extras. It can manage multiple email accounts."
"http://www.indeed.com/q-best-buy-l-anchorage,-ak-jobs.html?noci=1",Error - Could not fetch,"403 Client Error: Forbidden for url: https://www.indeed.com/q-best-buy-l-anchorage,-ak-jobs.html?noci=1"
https://www.chittorgarh.com/ipo/icici-prudential-amc-ipo/2525/,"ICICI Prudential AMC IPO Date, Price, GMP, Review, Details","Get ICICI Prudential AMC IPO details. Find IPO Date, Price, Live Subscription, Allotment, Grey Market Premium GMP, Listing Date, Analysis and Review."
https://m.economictimes.com/news/new-updates/who-is-monika-kapoor-the-accused-in-multi-crore-fraud-case-being-extradited-from-us-after-26-years/articleshow/122333461.cms,"Who is Monika Kapoor, the accused in multi-crore fraud case being extradited from US after 26 years? - The Economic Times","Monika Kapoor, wanted in India for a multi-crore fraud dating back to 1999, is being extradited from the U.S. on July 9, 2025, after a lengthy legal battle. She is accused of forging documents to fraudulently obtain duty-free import licenses, causing a significant financial loss to the Indian government. After overstaying her U.S."
https://www.cnet.com/tech/cnet-daily-tariff-price-tracker-im-tracking-11-key-products-for-changes-as-policies-shift-and-prime-day-arrives/,CNET Daily Tariff Price Tracker: I'm Tracking 11 Key Products for Changes as Policies Shift and Prime Day Arrives - CNET,"The deadline for the start of Trump's heaviest tariffs has been delayed as Amazon's Prime Day sales bonanza kicks off, making this as good a time as any to evade future price hikes."
https://www.techrepublic.com/article/ramp-vs-brex/,Error - Could not fetch,403 Client Error: Forbidden for url: https://www.techrepublic.com/article/ramp-vs-brex/
https://www.architecturaldigest.com/story/best-prime-day-deals-under-100-07-09-2025,66 Amazon Prime Day Deals Under $100 As Curated By A Broke Shopping Editor | Architectural Digest,"The best Prime Day deals under $100 on tech, furniture, and decor are here. Get in fast—these five-star products won't last long"
https://www.governmentjobs.com/jobs/5000368-0/mobile-equipment-operator-1-2-or-1-heavy,"MOBILE EQUIPMENT OPERATOR 1, 2 or 1 HEAVY in Statewide, LA | GovernmentJobs.com","Apply for MOBILE EQUIPMENT OPERATOR 1, 2 or 1 HEAVY position in Statewide, LA through GovernmentJobs.com. Join our team and become a part of State of Louisiana community."
https://www.consumerreports.org/cars/cars-driving/talking-cars-476-driving-the-nissan-armada-a9058350071/,Talking Cars 476: Driving the Nissan Armada - Consumer Reports,"Episode 476 of “Talking Cars With Consumer Reports” covers driving the Nissan Armada. The podcast panel also discusses the Jeep Compass, Mazda CX-90, and more."
https://www.instagram.com/reel/DL6EIgIxsJH/,Instagram,No Description Found
https://timesofindia.indiatimes.com/etimes/trending/who-is-linda-yaccarino-former-x-ceos-net-worth-education-family-and-more/articleshow/122347523.cms,"Who is Linda Yaccarino?: Former X CEO's net worth, education, family and more | - Times of India",Trending News: Linda Yaccarino resigns from her position as CEO of X. She thanks Elon Musk for the opportunity. Yaccarino highlights the team's work in user safety a
https://www.hollywoodreporter.com/tv/tv-news/disney-plus-itv-launch-partnership-taste-streaming-services-1236310979/,Disney and ITV Launch First-of-Its-Kind Alliance,"Disney and ITV will launch a new, first-of-its-kind initiative to carry &quot;a taste&quot; of each other’s streaming services, the companies have confirmed."
